Repository,Number,Body,class,Title,Combined_Text
caffe,1160,"hello!, every body. tried compile parallel version caffe, found make make test, can't run make runtest. error info error loading shared libraries libcudart.so.6.5 cannot open shared object file shuch file directory. installed cudnn version caffe common caffe, ok appear error. expert help me? thanks advance!",0,can't run tests caffe parallel version,"can't run tests caffe parallel version hello!, every body. tried compile parallel version caffe, found make make test, can't run make runtest. error info error loading shared libraries libcudart.so.6.5 cannot open shared object file shuch file directory. installed cudnn version caffe common caffe, ok appear error. expert help me? thanks advance!"
caffe,6279,please delete,0,please delete,please delete please delete
caffe,4376,gtx970 cuda7.0 cudnn4.0 opencv2.4.12 know solve problem! aborted 1467078048 unix time try date 1467078048 using gnu date pc 0x2b3690e4b897 cudnnaddtensor sigsegv 0x703105204 received pid 31656 tid 0x2b3682bce3c0 pid 51401220 stack trace 0x2b3689a1f340 unknown 0x2b3690e4b897 cudnnaddtensor 0x2b3688de8463 caffe cudnnconvolutionlayer forward gpu 0x48df76 caffe layer forward 0x93bd0f caffe cudnnconvolutionlayertest testsimpleconvolutioncudnn test testbody 0x9a4e53 testing internal handleexceptionsinmethodifsupported 0x99bb37 testing test run 0x99bbde testing testinfo run 0x99bce5 testing testcase run 0x99f028 testing internal unittestimpl runalltests 0x99f2b7 testing unittest run 0x473c7f main 0x2b3689c4eec5 libc start main 0x47ca69 unknown make runtest segmentation fault core dumped,0,make runtest error,make runtest error gtx970 cuda7.0 cudnn4.0 opencv2.4.12 know solve problem! aborted 1467078048 unix time try date 1467078048 using gnu date pc 0x2b3690e4b897 cudnnaddtensor sigsegv 0x703105204 received pid 31656 tid 0x2b3682bce3c0 pid 51401220 stack trace 0x2b3689a1f340 unknown 0x2b3690e4b897 cudnnaddtensor 0x2b3688de8463 caffe cudnnconvolutionlayer forward gpu 0x48df76 caffe layer forward 0x93bd0f caffe cudnnconvolutionlayertest testsimpleconvolutioncudnn test testbody 0x9a4e53 testing internal handleexceptionsinmethodifsupported 0x99bb37 testing test run 0x99bbde testing testinfo run 0x99bce5 testing testcase run 0x99f028 testing internal unittestimpl runalltests 0x99f2b7 testing unittest run 0x473c7f main 0x2b3689c4eec5 libc start main 0x47ca69 unknown make runtest segmentation fault core dumped
caffe,1143,"recruit, sorry foolish question. use cudnn caffe master, get result without cudnn. pc i7 4770k gtx 770, cuda 6.5 running time mnist 150s, cifar10 full 62s 1000 iteration. set use cudnn 1 , copy cudnn.h usr local include , copy libcudnn.so, libcudnn.so.6.5, libcudnn.so.6.5.18, libcudnn static.a usr local lib . right? seems work. help me, thank you!",0,right ? use cudnn....,"right ? use cudnn.... recruit, sorry foolish question. use cudnn caffe master, get result without cudnn. pc i7 4770k gtx 770, cuda 6.5 running time mnist 150s, cifar10 full 62s 1000 iteration. set use cudnn 1 , copy cudnn.h usr local include , copy libcudnn.so, libcudnn.so.6.5, libcudnn.so.6.5.18, libcudnn static.a usr local lib . right? seems work. help me, thank you!"
caffe,4205,"hi, trying build caffe python 3.4 ubuntu 14.04 keep issue python installed opencv 3 python 3 support worked nicely protobuf v3 beta still tried adding .bashrc work better full cmake log",0,cmake regex error dependencies python 3,"cmake regex error dependencies python 3 hi, trying build caffe python 3.4 ubuntu 14.04 keep issue python installed opencv 3 python 3 support worked nicely protobuf v3 beta still tried adding .bashrc work better full cmake log"
caffe,5910,"hello there! trying run cifar10 caffar10 example, implementation create cifar10.sh regardless caffe directory caffe examples cifar10 directory implementation, system always error . build examples cifar10 convert cifar data. bin found. please help big god help doubts.",0,create cifar10.sh 13 create cifar10.sh . build examples cifar10 convert cifar data.bin found,"create cifar10.sh 13 create cifar10.sh . build examples cifar10 convert cifar data.bin found hello there! trying run cifar10 caffar10 example, implementation create cifar10.sh regardless caffe directory caffe examples cifar10 directory implementation, system always error . build examples cifar10 convert cifar data. bin found. please help big god help doubts."
caffe,6311,system configuration operating system ubuntu16.04 compiler cuda version applicable 8.0 cudnn version applicable 7.0.5 blas python matlab version pycaffe matcaffe respectively 2.7 anaconda3 hope somebody could help me.thank you!,0,failed make,failed make system configuration operating system ubuntu16.04 compiler cuda version applicable 8.0 cudnn version applicable 7.0.5 blas python matlab version pycaffe matcaffe respectively 2.7 anaconda3 hope somebody could help me.thank you!
caffe,3546,sorry false issue.,0,caffe crashes hdf5 data used multi gpu system.,caffe crashes hdf5 data used multi gpu system. sorry false issue.
caffe,3667,"difference way predictions work case caffe.classifier caffe.net ? image linked run caffe example classification.ipynb gives prediction class 287 net.predict img .argmax . however, use image another example filter visualization.ipynb class probabilites net.blobs 'prob' .argmax comes 2! something trivial missing really happening? correct classification one correct tweaked cat image little bit see effects classification ? using bvlc reference caffenet.caffemodel corresponding deploy.prototxt imagenet mean image provided caffe default ilsvrc12 . sample cat image ! advr https cloud.githubusercontent.com assets 5744373 13016016 419b72b0 d1e2 11e5 9019 2a1791c56ad4.jpg",0,caffe.classifier caffe.net different class predictions image?,"caffe.classifier caffe.net different class predictions image? difference way predictions work case caffe.classifier caffe.net ? image linked run caffe example classification.ipynb gives prediction class 287 net.predict img .argmax . however, use image another example filter visualization.ipynb class probabilites net.blobs 'prob' .argmax comes 2! something trivial missing really happening? correct classification one correct tweaked cat image little bit see effects classification ? using bvlc reference caffenet.caffemodel corresponding deploy.prototxt imagenet mean image provided caffe default ilsvrc12 . sample cat image ! advr https cloud.githubusercontent.com assets 5744373 13016016 419b72b0 d1e2 11e5 9019 2a1791c56ad4.jpg"
caffe,2566,"get following errors make caffe. packages installed already. usr bin ld cannot find lleveldb usr bin ld cannot find lsnappy usr bin ld cannot find lboost system suggestions helpful, thanks lm",0,caffe make error,"caffe make error get following errors make caffe. packages installed already. usr bin ld cannot find lleveldb usr bin ld cannot find lsnappy usr bin ld cannot find lboost system suggestions helpful, thanks lm"
caffe,3246,"hi, new caffe. training phase, makes sense one type supported. mostly pre process training images. testing phase, sometimes want validate imagenet accuracy, suitable data input. sometimes, also want use prototxt model predict one single raw image, needs input type imagedata . know pycaffe easily handle this, shown 00 example. know whether cpp interface already supports this. otherwise, would like modify caffe.cpp support this. idea add another input test layer prototxt model. one input layer selected command line.or maybe guys better solutions? thanks lot advance.",0,test support several types test input one prototxt model,"test support several types test input one prototxt model hi, new caffe. training phase, makes sense one type supported. mostly pre process training images. testing phase, sometimes want validate imagenet accuracy, suitable data input. sometimes, also want use prototxt model predict one single raw image, needs input type imagedata . know pycaffe easily handle this, shown 00 example. know whether cpp interface already supports this. otherwise, would like modify caffe.cpp support this. idea add another input test layer prototxt model. one input layer selected command line.or maybe guys better solutions? thanks lot advance."
caffe,3833,"hi there, whether make mistake not, found bias 1x1 conv layer learnt exactly initialization value latest version caffe, even double check second mult lr set 2.0 prototxt. could anyone help load google net check bias value 1x1 layers, conv2 3x3 reduce ? apologize make something wrong.",0,bias learnt 1x1 conv layer,"bias learnt 1x1 conv layer hi there, whether make mistake not, found bias 1x1 conv layer learnt exactly initialization value latest version caffe, even double check second mult lr set 2.0 prototxt. could anyone help load google net check bias value 1x1 layers, conv2 3x3 reduce ? apologize make something wrong."
caffe,2661,"way specify specific layer run cpu rather gpu, still let layers run gpu? trying run softmaxwithlosslayer cpu since getting issues running gpu. would nice feature exist already.",0,specify per layer cpu gpu,"specify per layer cpu gpu way specify specific layer run cpu rather gpu, still let layers run gpu? trying run softmaxwithlosslayer cpu since getting issues running gpu. would nice feature exist already."
caffe,2506,"hello guys, wanna ask use caffe pretrain model, use papameters model initialize another model ? can, anyone teach it? thank you.",0,pretrain model using caffe,"pretrain model using caffe hello guys, wanna ask use caffe pretrain model, use papameters model initialize another model ? can, anyone teach it? thank you."
caffe,2362,"hi, older macbook pro 2009 nvidia geforce 9600m gt nvidia geforce 9400m cuda driver version 6.5.14 mathematica, matlab, theano can't use gpu. read cudnn requires cuda 3.0 greater . caffe run cuda 1.1? thanks advance!",0,caffe cuda 1.1,"caffe cuda 1.1 hi, older macbook pro 2009 nvidia geforce 9600m gt nvidia geforce 9400m cuda driver version 6.5.14 mathematica, matlab, theano can't use gpu. read cudnn requires cuda 3.0 greater . caffe run cuda 1.1? thanks advance!"
caffe,2584,running makes difference.,0,unit tests use custom parameters,unit tests use custom parameters running makes difference.
caffe,849,"wanna know resume training imagenet model caffe reference imagenet model . far concert, resume training needs .solverstate file model file. could download caffe reference imagenet model.solverstate somewhere? transform caffe reference imagenet model caffe reference imagenet model.solverstate ?",0,resume training imagenet model?,"resume training imagenet model? wanna know resume training imagenet model caffe reference imagenet model . far concert, resume training needs .solverstate file model file. could download caffe reference imagenet model.solverstate somewhere? transform caffe reference imagenet model caffe reference imagenet model.solverstate ?"
caffe,284,"system tested inputs unequal width height? use provided datalayer mirroring cropping disabled portrait inputs, first convolution layer quickly tends towards usually within first 500 iterations set filters horizontal bands. sometimes loss goes nan many parameters first convolution layer gone nan . wrote separate data layer replaces cropsize crop height crop width could manually specify rectangular crop. tried setting crop height crop width far issue shown up, spent much time training still much longer rectangular cases . set aspect ratio something 1, bands appear width seems depend aspect ratio crop. using imagenet architecture applied different dataset. inputs leveldb 264x105x3 cropped inputs network 220x88x3. issue reproducible solver mode 0 1.",0,non square inputs tested supported?,"non square inputs tested supported? system tested inputs unequal width height? use provided datalayer mirroring cropping disabled portrait inputs, first convolution layer quickly tends towards usually within first 500 iterations set filters horizontal bands. sometimes loss goes nan many parameters first convolution layer gone nan . wrote separate data layer replaces cropsize crop height crop width could manually specify rectangular crop. tried setting crop height crop width far issue shown up, spent much time training still much longer rectangular cases . set aspect ratio something 1, bands appear width seems depend aspect ratio crop. using imagenet architecture applied different dataset. inputs leveldb 264x105x3 cropped inputs network 220x88x3. issue reproducible solver mode 0 1."
caffe,4067,new release multigpu caffe may correct. quite different nvcaffe.,0,new release verify multigpu caffe?,new release verify multigpu caffe? new release multigpu caffe may correct. quite different nvcaffe.
caffe,3727,"could mistake mnist example https github.com bvlc caffe blob master examples mnist lenet train test.prototxt . conv layers followed non linearities. original paper followed sigmoids. tutorial http caffe.berkeleyvision.org gathered examples mnist.html, written sigmoids replaced relus. however, one relu fc layer. even confusing me, network without non linearities still seems perform extremely well classification... idea is?",0,non linearity conv layers mnist example,"non linearity conv layers mnist example could mistake mnist example https github.com bvlc caffe blob master examples mnist lenet train test.prototxt . conv layers followed non linearities. original paper followed sigmoids. tutorial http caffe.berkeleyvision.org gathered examples mnist.html, written sigmoids replaced relus. however, one relu fc layer. even confusing me, network without non linearities still seems perform extremely well classification... idea is?"
caffe,5680,"hundreds iterations,it crashed.and nvidia smi reveal gpu lost.reboot system recover gpu ,and situation happened use hdf5 data train model.",0,problem training process,"problem training process hundreds iterations,it crashed.and nvidia smi reveal gpu lost.reboot system recover gpu ,and situation happened use hdf5 data train model."
caffe,1127,"hi, good job, big fan. using pretrained caffenet model. test time want model 10 different cropping reflections. want model scale image 224 x 224 compute result. pickup features. way without retraining?",0,pretrained imagnet model cropping reflections test time,"pretrained imagnet model cropping reflections test time hi, good job, big fan. using pretrained caffenet model. test time want model 10 different cropping reflections. want model scale image 224 x 224 compute result. pickup features. way without retraining?"
caffe,3142,nan,0,src caffe data transformer.cpp 229 error invalid use incomplete type const struct cv mat,src caffe data transformer.cpp 229 error invalid use incomplete type const struct cv mat nan
caffe,4462,run network simple dummy python layer terminates hundred cycles. displayed errors always point cuda code. error occured changed label size large size 1x480x640 1x1x1 . system information reproduce.zip https github.com bvlc caffe files 364050 reproduce.zip fail.txt https github.com bvlc caffe files 364052 fail.txt,0,nondeterministic crashes pythonlayer,nondeterministic crashes pythonlayer run network simple dummy python layer terminates hundred cycles. displayed errors always point cuda code. error occured changed label size large size 1x480x640 1x1x1 . system information reproduce.zip https github.com bvlc caffe files 364050 reproduce.zip fail.txt https github.com bvlc caffe files 364052 fail.txt
caffe,4634,nan,0,demo question gpu,demo question gpu nan
caffe,4276,"meet strange question defines net using caffe.net, error attributeerror 'module' object attribute 'net' import caffe net caffe.net traceback recent call last file , line 1, attributeerror 'module' object attribute 'net' another one python . . caffe python classify.py model . bvlc reference caffenet deploy.prototxt weights . bvlc reference caffenet bvlc reference caffenet.caffemodel gpu failed include caffe pb2, things might go wrong! traceback recent call last file usr local lib python3.4 dist packages google protobuf internal python message.py , line 1091, mergefromstring self. internalparse serialized, 0, length ! length file usr local lib python3.4 dist packages google protobuf internal python message.py , line 1113, internalparse tag bytes, new pos local readtag buffer, pos file usr local lib python3.4 dist packages google protobuf internal decoder.py , line 181, readtag six.indexbytes buffer, pos 0x80 typeerror unsupported operand type 'str' 'int' handling exception, another exception occurred traceback recent call last file home ndscbigdata caffe python classify.py , line 14, import caffe file home ndscbigdata caffe python caffe init .py , line 4, .proto.caffe pb2 import train, test file home ndscbigdata caffe python caffe proto caffe pb2.py , line 799, options descriptor. parseoptions descriptor pb2.fieldoptions , ' 020 001' , file usr local lib python3.4 dist packages google protobuf descriptor.py , line 845, parseoptions message.parsefromstring string file usr local lib python3.4 dist packages google protobuf message.py , line 185, parsefromstring self.mergefromstring serialized file usr local lib python3.4 dist packages google protobuf internal python message.py , line 1097, mergefromstring raise message mod.decodeerror 'truncated message.' google.protobuf.message.decodeerror truncated message.",0,attributeerror 'module' object attribute 'net',"attributeerror 'module' object attribute 'net' meet strange question defines net using caffe.net, error attributeerror 'module' object attribute 'net' import caffe net caffe.net traceback recent call last file , line 1, attributeerror 'module' object attribute 'net' another one python . . caffe python classify.py model . bvlc reference caffenet deploy.prototxt weights . bvlc reference caffenet bvlc reference caffenet.caffemodel gpu failed include caffe pb2, things might go wrong! traceback recent call last file usr local lib python3.4 dist packages google protobuf internal python message.py , line 1091, mergefromstring self. internalparse serialized, 0, length ! length file usr local lib python3.4 dist packages google protobuf internal python message.py , line 1113, internalparse tag bytes, new pos local readtag buffer, pos file usr local lib python3.4 dist packages google protobuf internal decoder.py , line 181, readtag six.indexbytes buffer, pos 0x80 typeerror unsupported operand type 'str' 'int' handling exception, another exception occurred traceback recent call last file home ndscbigdata caffe python classify.py , line 14, import caffe file home ndscbigdata caffe python caffe init .py , line 4, .proto.caffe pb2 import train, test file home ndscbigdata caffe python caffe proto caffe pb2.py , line 799, options descriptor. parseoptions descriptor pb2.fieldoptions , ' 020 001' , file usr local lib python3.4 dist packages google protobuf descriptor.py , line 845, parseoptions message.parsefromstring string file usr local lib python3.4 dist packages google protobuf message.py , line 185, parsefromstring self.mergefromstring serialized file usr local lib python3.4 dist packages google protobuf internal python message.py , line 1097, mergefromstring raise message mod.decodeerror 'truncated message.' google.protobuf.message.decodeerror truncated message."
caffe,1993,"hi, tried train model bvlc reference caffenet data set, problem anyone tell fix it? ! screen shot 2015 02 26 11 18 01 pm https cloud.githubusercontent.com assets 11225386 6409029 76ee1e34 be12 11e4 8e3c 4be0f42a528c.png",0,error unix time try using gnu date,"error unix time try using gnu date hi, tried train model bvlc reference caffenet data set, problem anyone tell fix it? ! screen shot 2015 02 26 11 18 01 pm https cloud.githubusercontent.com assets 11225386 6409029 76ee1e34 be12 11e4 8e3c 4be0f42a528c.png"
caffe,5173,"step make all, following error build release lib libcaffe.so jpeg createcompress .build release lib libcaffe.so google protobuf descriptorpool findfilebyname std string const const .build release lib libcaffe.so imf 2 2 outputfile outputfile .build release lib libcaffe.so google protobuf internal wireformatlite readbytes google protobuf io codedinputstream , std string undefine ref .build release lib libcaffe.so png create info struct .build release lib libcaffe.so jpeg std error .build release lib libcaffe.so google protobuf message initializationerrorstring const .build release lib libcaffe.so png set compression level collect2 error ld returned 1 exit status makefile 620 recipe target '.build release tools compute image mean.bin' failed make .build release tools compute image mean.bin error 1",0,vmware ubuntu16 undefined issue,"vmware ubuntu16 undefined issue step make all, following error build release lib libcaffe.so jpeg createcompress .build release lib libcaffe.so google protobuf descriptorpool findfilebyname std string const const .build release lib libcaffe.so imf 2 2 outputfile outputfile .build release lib libcaffe.so google protobuf internal wireformatlite readbytes google protobuf io codedinputstream , std string undefine ref .build release lib libcaffe.so png create info struct .build release lib libcaffe.so jpeg std error .build release lib libcaffe.so google protobuf message initializationerrorstring const .build release lib libcaffe.so png set compression level collect2 error ld returned 1 exit status makefile 620 recipe target '.build release tools compute image mean.bin' failed make .build release tools compute image mean.bin error 1"
caffe,2078,"hello, suspect might bug introduced commit 3d30510 pr 2059 . environment tested mac os x 10.10. tested ubuntu, since linux machine matlab installed now. however, building matcaffe fails message . let's see command line argument passed absolute paths replaced . python related link flags, , added reason fails might ordering link flags changed internal invocation, thus able link dynamic module. build step cmake, succeeds prior 3d30510. doubtful flags e.g. necessary build matlab targets, flags could removed building matlab bindings build could successful box. currently, tried workaround setting , inspection find better solution, think could submit pr fix this. thanks.",0,cmake dbuild matlab fails,"cmake dbuild matlab fails hello, suspect might bug introduced commit 3d30510 pr 2059 . environment tested mac os x 10.10. tested ubuntu, since linux machine matlab installed now. however, building matcaffe fails message . let's see command line argument passed absolute paths replaced . python related link flags, , added reason fails might ordering link flags changed internal invocation, thus able link dynamic module. build step cmake, succeeds prior 3d30510. doubtful flags e.g. necessary build matlab targets, flags could removed building matlab bindings build could successful box. currently, tried workaround setting , inspection find better solution, think could submit pr fix this. thanks."
caffe,2792,"installing caffe mac book. able get compile run cpu mode, cannot get compile gpu. followed installation instructions http caffe.berkeleyvision.org installation.html sure next. mac book pro running os x 10.10.4. graphics card intel iris pro gpu. using python anaconda distribution. installed dependencies outlined os x installation page http caffe.berkeleyvision.org install osx.html via homebrew. installed cuda 7 mac os cuda website https developer.nvidia.com cuda downloads . cuda tools installed beneath usr local cuda. cloned caffe distribution https github.com bvlc caffe. commit 247d6d66 july 15, 2015. makefile.config uncommented python anaconda include lines otherwise left things same. make clean make builds lot .cpp files fails first time tries use nvcc compiler sp counted base clang.hpp looks fine me. line 27 first line neither include namespace statement. two includes preceding maybe something wrong boost configuration, although able install boost via homebrew without problem. uncomment cpu 1 makefile.config another clean build, get compiler errors. try run tests problem described issue https github.com bvlc caffe issues 1737. work around soft linking libhdf58 libraries libhdf9 specifying hdf5 headers usr local include common flags makefile. think related cuda compilation issue. ideas cuda code compiling me?",0,cuda compilation issue macbook,"cuda compilation issue macbook installing caffe mac book. able get compile run cpu mode, cannot get compile gpu. followed installation instructions http caffe.berkeleyvision.org installation.html sure next. mac book pro running os x 10.10.4. graphics card intel iris pro gpu. using python anaconda distribution. installed dependencies outlined os x installation page http caffe.berkeleyvision.org install osx.html via homebrew. installed cuda 7 mac os cuda website https developer.nvidia.com cuda downloads . cuda tools installed beneath usr local cuda. cloned caffe distribution https github.com bvlc caffe. commit 247d6d66 july 15, 2015. makefile.config uncommented python anaconda include lines otherwise left things same. make clean make builds lot .cpp files fails first time tries use nvcc compiler sp counted base clang.hpp looks fine me. line 27 first line neither include namespace statement. two includes preceding maybe something wrong boost configuration, although able install boost via homebrew without problem. uncomment cpu 1 makefile.config another clean build, get compiler errors. try run tests problem described issue https github.com bvlc caffe issues 1737. work around soft linking libhdf58 libraries libhdf9 specifying hdf5 headers usr local include common flags makefile. think related cuda compilation issue. ideas cuda code compiling me?"
