Repository,Number,Body,class,Title,Combined_Text
caffe,58,"run caffe training dataset. iteration 1620, program crushed cublassgemm. log listed following, give advices fixing error? i0127 14 31 22.608165 19425 solver.cpp 204 iteration 1580, lr 0.01 i0127 14 31 22.609833 19425 solver.cpp 66 iteration 1580, loss 0.0217456 i0127 14 31 49.345432 19425 solver.cpp 204 iteration 1600, lr 0.01 i0127 14 31 49.347100 19425 solver.cpp 66 iteration 1600, loss 0.0122987 i0127 14 32 16.079083 19425 solver.cpp 204 iteration 1620, lr 0.01 i0127 14 32 16.080762 19425 solver.cpp 66 iteration 1620, loss 1.67767 f0127 14 32 39.484519 19425 math functions.cpp 45 check failed cublassgemm v2 caffe cublas handle , cutransb, cutransa, n, m, k, alpha, b, ldb, a, lda, beta, c, n cublas status success 14 vs. 0 check failure stack trace 0x7fa69de70b7d google logmessage fail 0x7fa69de72c7f google logmessage sendtolog 0x7fa69de7076c google logmessage flush 0x7fa69de7351d google logmessagefatal logmessagefatal 0x42ee79 caffe caffe gpu gemm 0x45f7e2 caffe convolutionlayer backward gpu 0x42770b caffe net backward 0x421278 caffe solver solve 0x40d055 main",0,"crash iteration 1620. check failed,cublassgemm","crash iteration 1620. check failed,cublassgemm run caffe training dataset. iteration 1620, program crushed cublassgemm. log listed following, give advices fixing error? i0127 14 31 22.608165 19425 solver.cpp 204 iteration 1580, lr 0.01 i0127 14 31 22.609833 19425 solver.cpp 66 iteration 1580, loss 0.0217456 i0127 14 31 49.345432 19425 solver.cpp 204 iteration 1600, lr 0.01 i0127 14 31 49.347100 19425 solver.cpp 66 iteration 1600, loss 0.0122987 i0127 14 32 16.079083 19425 solver.cpp 204 iteration 1620, lr 0.01 i0127 14 32 16.080762 19425 solver.cpp 66 iteration 1620, loss 1.67767 f0127 14 32 39.484519 19425 math functions.cpp 45 check failed cublassgemm v2 caffe cublas handle , cutransb, cutransa, n, m, k, alpha, b, ldb, a, lda, beta, c, n cublas status success 14 vs. 0 check failure stack trace 0x7fa69de70b7d google logmessage fail 0x7fa69de72c7f google logmessage sendtolog 0x7fa69de7076c google logmessage flush 0x7fa69de7351d google logmessagefatal logmessagefatal 0x42ee79 caffe caffe gpu gemm 0x45f7e2 caffe convolutionlayer backward gpu 0x42770b caffe net backward 0x421278 caffe solver solve 0x40d055 main"
caffe,54,"currently, algorithm codes quite aware memory layout underlying data. adding matrix class helps separate concerns different modules good practice software engineering. biggest benefit simplify coding improve development productivity. also ease understanding existing future algorithms. result, see accelerated development adoption progresses. matrix class intended view 2d array contained blob. main functionality provide high level wrappers common operations. write like codes like following snippets. convolution fully connected layer relu activation softmax activation see, api highly inspired matlab also motivates arrayfire c . course snippets rough sketches. many details need considered. example, performance price boost move operations high, could replaced shared ptr would complicate user codes little. another question pass shared ptr result matrix instead returning it. importantly, gpu codes may greatly differ cpu codes depending whether cuda play well proposed api syntax. therefore, issue's scope limited implementation matrix classes kinds devices. porting algorithms put independent issues benchmark results show performance gap low level api proposed high level api. welcome efforts refine api help implement it.",0,implement matrix class abstract algorithms away data storage details,"implement matrix class abstract algorithms away data storage details currently, algorithm codes quite aware memory layout underlying data. adding matrix class helps separate concerns different modules good practice software engineering. biggest benefit simplify coding improve development productivity. also ease understanding existing future algorithms. result, see accelerated development adoption progresses. matrix class intended view 2d array contained blob. main functionality provide high level wrappers common operations. write like codes like following snippets. convolution fully connected layer relu activation softmax activation see, api highly inspired matlab also motivates arrayfire c . course snippets rough sketches. many details need considered. example, performance price boost move operations high, could replaced shared ptr would complicate user codes little. another question pass shared ptr result matrix instead returning it. importantly, gpu codes may greatly differ cpu codes depending whether cuda play well proposed api syntax. therefore, issue's scope limited implementation matrix classes kinds devices. porting algorithms put independent issues benchmark results show performance gap low level api proposed high level api. welcome efforts refine api help implement it."
caffe,6325,please read guidelines contributing https github.com bvlc caffe blob master contributing.md submitting issue. issue summary error sudo make j8 system configuration operating system linux mint based ubuntu version 16.04 compiler cuda version applicable 8.0 cudnn version applicable 7.0,0,"error make all, cudnn convolution fwd algo winograd declared scope","error make all, cudnn convolution fwd algo winograd declared scope please read guidelines contributing https github.com bvlc caffe blob master contributing.md submitting issue. issue summary error sudo make j8 system configuration operating system linux mint based ubuntu version 16.04 compiler cuda version applicable 8.0 cudnn version applicable 7.0"
caffe,6859,"important read submitting please read guidelines contributing https github.com bvlc caffe blob master contributing.md submitting issue! please post installation, build, usage, modeling questions, requests help issues. use caffe users list https groups.google.com forum !forum caffe users instead. helps developers maintain clear, uncluttered, efficient view state caffe. issue summary steps reproduce tried solutions system configuration operating system compiler cuda version applicable cudnn version applicable blas python version using pycaffe matlab version using matcaffe issue checklist read guidelines removed first paragraph written short summary detailed steps reproduce explained solutions related problems failed tick found none filled system configuration attached relevant logs config files tick applicable",0,make lmdb using regression data e.g. 0001.jpg 0.865,"make lmdb using regression data e.g. 0001.jpg 0.865 important read submitting please read guidelines contributing https github.com bvlc caffe blob master contributing.md submitting issue! please post installation, build, usage, modeling questions, requests help issues. use caffe users list https groups.google.com forum !forum caffe users instead. helps developers maintain clear, uncluttered, efficient view state caffe. issue summary steps reproduce tried solutions system configuration operating system compiler cuda version applicable cudnn version applicable blas python version using pycaffe matlab version using matcaffe issue checklist read guidelines removed first paragraph written short summary detailed steps reproduce explained solutions related problems failed tick found none filled system configuration attached relevant logs config files tick applicable"
caffe,6832,"run code githubwhich face alignment two stage initialization ,i got following error i0911 08 08 29.921020 12228 layer factory.hpp 88 creating layer input i0911 08 08 29.922020 12228 net.cpp 100 creating layer input i0911 08 08 29.922020 12228 net.cpp 418 input data i0911 08 08 29.923020 12228 net.cpp 150 setting input i0911 08 08 29.924021 12228 net.cpp 157 top shape 1 3 448 448 602112 i0911 08 08 29.927022 12228 net.cpp 165 memory required data 2408448 i0911 08 08 29.927022 12228 layer factory.hpp 88 creating layer data input 0 split i0911 08 08 29.928025 12228 net.cpp 100 creating layer data input 0 split i0911 08 08 29.928025 12228 net.cpp 444 data input 0 split data i0911 08 08 29.929024 12228 net.cpp 418 data input 0 split data input 0 split 0 i0911 08 08 29.930024 12228 net.cpp 418 data input 0 split data input 0 split 1 i0911 08 08 29.930024 12228 net.cpp 150 setting data input 0 split i0911 08 08 29.930024 12228 net.cpp 157 top shape 1 3 448 448 602112 i0911 08 08 29.932025 12228 net.cpp 157 top shape 1 3 448 448 602112 i0911 08 08 29.932025 12228 net.cpp 165 memory required data 7225344 i0911 08 08 29.932025 12228 layer factory.hpp 88 creating layer downsample data i0911 08 08 29.932025 12228 net.cpp 100 creating layer downsample data i0911 08 08 29.932025 12228 net.cpp 444 downsample data data input 0 split 0 i0911 08 08 29.932025 12228 net.cpp 418 downsample data downsample data i0911 08 08 29.932025 12228 net.cpp 150 setting downsample data i0911 08 08 29.932025 12228 net.cpp 157 top shape 0 i0911 08 08 29.932025 12228 net.cpp 165 memory required data 7225344 i0911 08 08 29.933027 12228 layer factory.hpp 88 creating layer net1 conv1 i0911 08 08 29.933027 12228 net.cpp 100 creating layer net1 conv1 i0911 08 08 29.933027 12228 net.cpp 444 net1 conv1 downsample data i0911 08 08 29.933027 12228 net.cpp 418 net1 conv1 net1 conv1 f0911 08 08 29.933027 12228 blob.hpp 122 check failed axis index num axes 1 vs. 0 axis 1 range 0 blob shape 0 check failure stack trace part deploy follows. name facial point net input data input dim 1 input dim 3 input dim 448 input dim 448 layer name downsample data type subsamplepooling bottom data top downsample data subsample pooling param output h 60 output w 60 layer name net1 conv1 type convolution bottom downsample data top net1 conv1 param lr mult 1 decay mult 1 param lr mult 2 decay mult 0 convolution param num output 20 pad 0 kernel size 5 stride 1 weight filler type gaussian std 0.01 bias filler type constant value 0 layer name net1 prelu1 type prelu bottom net1 conv1 top net1 conv1 layer name net1 pool1 type pooling bottom net1 conv1 top net1 pool1 pooling param pool max kernel size 2 stride 2 anyone know problem ?",0,check failed axis index num axes 1 vs. 0 axis 1 range 0 blob shape 0,"check failed axis index num axes 1 vs. 0 axis 1 range 0 blob shape 0 run code githubwhich face alignment two stage initialization ,i got following error i0911 08 08 29.921020 12228 layer factory.hpp 88 creating layer input i0911 08 08 29.922020 12228 net.cpp 100 creating layer input i0911 08 08 29.922020 12228 net.cpp 418 input data i0911 08 08 29.923020 12228 net.cpp 150 setting input i0911 08 08 29.924021 12228 net.cpp 157 top shape 1 3 448 448 602112 i0911 08 08 29.927022 12228 net.cpp 165 memory required data 2408448 i0911 08 08 29.927022 12228 layer factory.hpp 88 creating layer data input 0 split i0911 08 08 29.928025 12228 net.cpp 100 creating layer data input 0 split i0911 08 08 29.928025 12228 net.cpp 444 data input 0 split data i0911 08 08 29.929024 12228 net.cpp 418 data input 0 split data input 0 split 0 i0911 08 08 29.930024 12228 net.cpp 418 data input 0 split data input 0 split 1 i0911 08 08 29.930024 12228 net.cpp 150 setting data input 0 split i0911 08 08 29.930024 12228 net.cpp 157 top shape 1 3 448 448 602112 i0911 08 08 29.932025 12228 net.cpp 157 top shape 1 3 448 448 602112 i0911 08 08 29.932025 12228 net.cpp 165 memory required data 7225344 i0911 08 08 29.932025 12228 layer factory.hpp 88 creating layer downsample data i0911 08 08 29.932025 12228 net.cpp 100 creating layer downsample data i0911 08 08 29.932025 12228 net.cpp 444 downsample data data input 0 split 0 i0911 08 08 29.932025 12228 net.cpp 418 downsample data downsample data i0911 08 08 29.932025 12228 net.cpp 150 setting downsample data i0911 08 08 29.932025 12228 net.cpp 157 top shape 0 i0911 08 08 29.932025 12228 net.cpp 165 memory required data 7225344 i0911 08 08 29.933027 12228 layer factory.hpp 88 creating layer net1 conv1 i0911 08 08 29.933027 12228 net.cpp 100 creating layer net1 conv1 i0911 08 08 29.933027 12228 net.cpp 444 net1 conv1 downsample data i0911 08 08 29.933027 12228 net.cpp 418 net1 conv1 net1 conv1 f0911 08 08 29.933027 12228 blob.hpp 122 check failed axis index num axes 1 vs. 0 axis 1 range 0 blob shape 0 check failure stack trace part deploy follows. name facial point net input data input dim 1 input dim 3 input dim 448 input dim 448 layer name downsample data type subsamplepooling bottom data top downsample data subsample pooling param output h 60 output w 60 layer name net1 conv1 type convolution bottom downsample data top net1 conv1 param lr mult 1 decay mult 1 param lr mult 2 decay mult 0 convolution param num output 20 pad 0 kernel size 5 stride 1 weight filler type gaussian std 0.01 bias filler type constant value 0 layer name net1 prelu1 type prelu bottom net1 conv1 top net1 conv1 layer name net1 pool1 type pooling bottom net1 conv1 top net1 pool1 pooling param pool max kernel size 2 stride 2 anyone know problem ?"
caffe,5589,"try train alexnet imagenet. read train val.prototxt, transform param transform param mirror true crop size 227 mean file data ilsvrc12 imagenet mean.binaryproto example mnist tutorial, scale parameter normalize pixel value 0, 255 0, 1 , listed transform param scale 0.00390625 tried add scale 0.00390625 transform param case, accuracy becomes poor. lmdb data converted build tools convert imageset already normalized? tried trace codes tools convert imageset found image loaded function readimagetodatum . readfiletodatum called readimagetodatum. finally readfiletodatum, still don's see codes normalizing pixel value. scale 0.00390625 available mnist example examples? lmdb data normalized, normalization done? thanks",0,scale within transform param data layer used mnist example applied imagenet example?,"scale within transform param data layer used mnist example applied imagenet example? try train alexnet imagenet. read train val.prototxt, transform param transform param mirror true crop size 227 mean file data ilsvrc12 imagenet mean.binaryproto example mnist tutorial, scale parameter normalize pixel value 0, 255 0, 1 , listed transform param scale 0.00390625 tried add scale 0.00390625 transform param case, accuracy becomes poor. lmdb data converted build tools convert imageset already normalized? tried trace codes tools convert imageset found image loaded function readimagetodatum . readfiletodatum called readimagetodatum. finally readfiletodatum, still don's see codes normalizing pixel value. scale 0.00390625 available mnist example examples? lmdb data normalized, normalization done? thanks"
caffe,745,"currently creating several million artificial data images python, would like stored leveldb fed caffe. moment saving images directly file, using 'create leveldb.sh' create leveldb directories. creates problem save couple million images hdd. trying python directly save artificial images leveldb, without save image file. currently, code trying emulate happens 'readimagetodatum' io.cpp. leveldb created code matches size number leveldb files leveldb created convert imageset.bin however, train caffe leveldb directory, test 1 test 2 get worse time. suspecting missed something converting image string format, may missed something completely different.",0,creating leveldb python,"creating leveldb python currently creating several million artificial data images python, would like stored leveldb fed caffe. moment saving images directly file, using 'create leveldb.sh' create leveldb directories. creates problem save couple million images hdd. trying python directly save artificial images leveldb, without save image file. currently, code trying emulate happens 'readimagetodatum' io.cpp. leveldb created code matches size number leveldb files leveldb created convert imageset.bin however, train caffe leveldb directory, test 1 test 2 get worse time. suspecting missed something converting image string format, may missed something completely different."
caffe,2259,"trouble compiling caffe jetson tk1 board. already cudnn v2 set up, following instructions install caffe get 'make j 4 all' step, execute step, compilation, get several errors 'functions declared scope' several errors terminate compilation. know caffe cudnn v2 play well together yet , version caffe should. advice? thanks!",0,cudnn v2 caffe jetson tk1,"cudnn v2 caffe jetson tk1 trouble compiling caffe jetson tk1 board. already cudnn v2 set up, following instructions install caffe get 'make j 4 all' step, execute step, compilation, get several errors 'functions declared scope' several errors terminate compilation. know caffe cudnn v2 play well together yet , version caffe should. advice? thanks!"
